name,codes,description
TTL_PERIOD_INVALID,400,The provided TTL Period is invalid
TYPES_EMPTY,400,The types field is empty
TYPE_CONSTRUCTOR_INVALID,400,The type constructor is invalid
UNKNOWN_ERROR,400,
UNKNOWN_METHOD,500,The method you tried to call cannot be called on non-CDN DCs
UNTIL_DATE_INVALID,400,That date cannot be specified in this request (try using None)
URL_INVALID,400,The URL used was invalid (e.g. when answering a callback with a URL that's not t.me/yourbot or your game's URL)
USER_VOLUME_INVALID,400,
USERNAME_INVALID,400,"Nobody is using this username, or the username is unacceptable. If the latter, it must match r""[a-zA-Z][\w\d]{3,30}[a-zA-Z\d]"""
USERNAME_NOT_MODIFIED,400,The username is not different from the current username
USERNAME_NOT_OCCUPIED,400,The username is not in use by anyone else yet
USERNAME_OCCUPIED,400,The username is already taken
USERS_TOO_FEW,400,"Not enough users (to create a chat, for example)"
USERS_TOO_MUCH,400,"The maximum number of users has been exceeded (to create a chat, for example)"
USER_ADMIN_INVALID,400,Either you're not an admin or you tried to ban an admin that you didn't promote
USER_ALREADY_INVITED,400,
USER_ALREADY_PARTICIPANT,400,The authenticated user is already a participant of the chat
USER_BANNED_IN_CHANNEL,400,You're banned from sending messages in supergroups/channels
USER_BLOCKED,400,User blocked
USER_BOT,400,Bots can only be admins in channels.
USER_BOT_INVALID,400 403,This method can only be called by a bot
USER_BOT_REQUIRED,400,This method can only be called by a bot
USER_CHANNELS_TOO_MUCH,403,One of the users you tried to add is already in too many channels/supergroups
USER_CREATOR,400,"You can't leave this channel, because you're its creator"
USER_DEACTIVATED,401,The user has been deleted/deactivated
USER_DEACTIVATED_BAN,401,The user has been deleted/deactivated
USER_ID_INVALID,400,"Invalid object ID for a user. Make sure to pass the right types, for instance making sure that the request is designed for users or otherwise look for a different one more suited"
USER_INVALID,400,The given user was invalid
USER_IS_BLOCKED,400 403,User is blocked
USER_IS_BOT,400,Bots can't send messages to other bots
USER_KICKED,400,This user was kicked from this supergroup/channel
USER_MIGRATE_X,303,The user whose identity is being used to execute queries is associated with DC {new_dc}
USER_NOT_MUTUAL_CONTACT,400 403,The provided user is not a mutual contact
USER_NOT_PARTICIPANT,400,The target user is not a member of the specified megagroup or channel
USER_PRIVACY_RESTRICTED,403,The user's privacy settings do not allow you to do this
USER_RESTRICTED,403,"You're spamreported, you can't create channels or chats."
USERPIC_UPLOAD_REQUIRED,400,You must have a profile picture before using this method
VIDEO_CONTENT_TYPE_INVALID,400,The video content type is not supported with the given parameters (i.e. supports_streaming)
VIDEO_FILE_INVALID,400,The given video cannot be used
VIDEO_TITLE_EMPTY,400,
WALLPAPER_FILE_INVALID,400,The given file cannot be used as a wallpaper
WALLPAPER_INVALID,400,The input wallpaper was not valid
WALLPAPER_MIME_INVALID,400,
WC_CONVERT_URL_INVALID,400,WC convert URL invalid
WEBDOCUMENT_MIME_INVALID,400,
WEBDOCUMENT_URL_INVALID,400,The given URL cannot be used
WEBPAGE_CURL_FAILED,400,Failure while fetching the webpage with cURL
WEBPAGE_MEDIA_EMPTY,400,Webpage media empty
WORKER_BUSY_TOO_LONG_RETRY,500,Telegram workers are too busy to respond immediately
YOU_BLOCKED_USER,400,You blocked this user
